commit	accuracy	avg_searches	avg_tokens	status	description
baseline	0.0181	1.0	2810	keep	Original prompt, single search, k=5
490d200	0.0333	1.3	2972	keep	Stronger answer format + multi-search prompt
3de3c41	0.0333	2.0	5789	discard	Force min 2 searches + nudge (no improvement)
490d200	0.0000	1.5	2999	discard	k=10 (worse, confused model)
48b7fe4	0.0333	1.1	2847	discard	BM25-aware keyword prompt + 500 char snippets
627bbf1	0.0667	1.2	3130	keep	Python tool added (search+get_doc+python)
c860723	0.0333	1.8	3258	discard	Python-only tool (model not using search well)
64ddf5c	0.0000	4.0	4273	discard	Auto pre-search with keywords (noise hurt)
ouros-v1	0.0333	3.9	2522	keep	ouros runtime, fixed agent script (baseline)
rlm-v1	0.0333	~8	9573	discard	rLM loop + ouros REPL, no timeout (7/30 before stall)
rlm-v2	0.0667	~8	9319	keep	rLM loop, anti-hedge prompt, 90s timeout, batch_llm_query
bfcedf2	0.0333	~6	6068	discard	k=10, improved search prompt, 60s timeout (regression)
503efde-7b	0.0333	~6	7067	discard	concise prompt, get_document emphasis, qwen2.5:7b
0bb370a-7b	0.0333	~6	7878	discard	pre-search + 3000 snippets, qwen2.5:7b
qwen3.5-4b-think	0.0333	~6	20165	discard	qwen3.5:4b with thinking (29/30 "Unable to determine")
qwen3.5-4b	0.0667	~6	20516	keep	qwen3.5:4b /no_think, got 1144+830
qwen3.5-9b	0.0333	~6	16405	discard	qwen3.5:9b /no_think, got 853 only (too conservative)
rlm-v3-4b	0.0667	~6	33176	keep	rLM-style context+llm_query prompt, qwen3.5:4b, got 191+1128 (new: Kiki Gyan!)
rlm-v3-9b	0.1333	~6	37291	keep	rLM-style context+llm_query, qwen3.5:9b, got 191+464+797+853 (2x previous best!)
dspy-v1-9b	0.2667	~12	139590	keep	DSPy insights: 12 turns, 8K output, vars_info, fallback extract, EXPLORE/VERIFY directives. 8/30: 159+175+191+464+572+797+830+1128
retrieval-v1-9b	0.3000	~12	188074	BEST	k=10, 5 pre-search queries, search decomposition prompt, verify directive. 9/30: +469+853+885, -572-830
subfact-v1-9b	0.2333	~12	162387	keep	8 diverse pre-search queries (sub-fact decomposition), k=5 presearch / k=10 REPL, sub-fact iteration prompts. 7/30: +1144, high variance. Union across runs: 12/30 (40%)
ranking-v1-9b	0.2000	~12	84089	discard	LLM ranking of pre-search results (40→15), think:false for utilities. Regression — ranking adds overhead without benefit (1/5 partial)
think-opt-9b	0.2333	~12	127446	keep	think:false for utility calls (pre-search, fallback), no ranking, 5 pre-search queries. 7/30: 159+191+464+572+797+853+1128
bon3-vote-9b	0.2333	~12	389115	discard	Best-of-3 majority vote. 7/30 same accuracy, 3x tokens. Voting picks common wrong answer over rare correct one
hybrid-rrf-9b	0.1000	~12	115340	discard	Hybrid BM25+LanceDB with RRF equal weighting. 3/30 regression — vector results dilute BM25 precision
hybrid-aug-9b	0.3000	~12	140840	BEST-TIE	BM25-first + vector augmentation (k extra vector-unique docs). 9/30, matches retrieval-v1. Full 100K LanceDB index
dualq-presearch-9b	0.1111	~12	~150000	discard	Dual BM25+vector pre-search queries. 1/9 — too many context docs overwhelm model, BM25 query quality degrades
vsearch-tool-9b	0.2000	~12	156729	discard	vector_search() as REPL tool. 6/30: +643, -175-469-853-885. Model over-uses it, wastes turns on semantic search
pyanalysis-9b	0.2000	~12	162654	discard	Python analysis emphasis in prompt. 5/25 (crash Q26). No improvement — analysis not the bottleneck
turns16-9b	0.1000	~16	155708	discard	16 turns (vs 12). 3/30 regression — model second-guesses with extra iterations
refine-add-9b	0.2000	~12	164974	discard	Pre-search refinement (add round-2 queries). 6/30: +1128+572, -159-175-469-830-885. Too many context docs (50-60)
refine-filter-9b	0.2333	~12	175239	keep	Pre-search filter+refine (keep top-10, add 3 new queries). 7/30: +572+643, -175-469-830-853. Avg 31 context docs
native-bm25-9b	0.1000	~12	115340	discard	Native Rust tantivy BM25 (no stopwords, no query sanitization). 3/30 — tantivy query parser chokes on apostrophes
native-bm25-fix-9b	0.1667	~12	127000	discard	Native BM25 + query sanitization (strip '"()[]{}~^\). 5/30: +2 from parse fix, still trails Python BM25s
native-bm25-sw-9b	0.2000	~35	142998	keep	Native BM25 + en_stopwords tokenizer (matching bm25s defaults). 6/30: stopword removal +20% relative
native-hybrid-9b	0.2333	~12	140000	keep	Native hybrid BM25+LanceDB RRF (no stopwords). 7/30 — proper RRF fusion, no Python server
native-hybrid-sw-9b	0.3333	~35	150028	BEST	Native hybrid + en_stopwords tokenizer. 10/30: 159+175+191+464+572+797+853+1030+1128+1144. Beats Python baseline (9/30)
mar16-baseline	0.2333	~12	108725	keep	Reproduce native-hybrid-sw baseline. 7/30 (non-deterministic)
mar16-hybrid-presearch	0.2333	~12	166839	discard	Hybrid BM25+vector pre-search. 7/30, 53% more tokens
8de0830	0.3333	~12	128848	BEST-TIE	Doc-grounded prompts: force get_document+llm_query, stronger verification. 10/30
mar16-earlysubmit	0.3000	~12	113513	keep	Early-submit prompt when evidence found. 9/30
mar16-widepresearch	0.2667	~12	154344	discard	Wider pre-search (8+5 queries, full k). 8/30, too many context docs
mar16-hybridsearch	0.2333	~12	108647	discard	Hybrid default search() in REPL. 7/30, vector search adds no value
mar16-searchcoach	0.2333	~12	126580	discard	Search query coaching in prompt. 7/30, high run-to-run variance dominates
f6d4868	0.3667	~12	149481	NEW-BEST	Boosted BM25 (phrase+AND+OR) + HyDE passage + PRF terms. 11/30 — new all-time best!
f6d4868-repro	0.3000	~12	152215	keep	Reproducibility run. 9/30
ablate-nohyde	0.3667	~12	168311	keep	Ablation: no HyDE. 11/30 — HyDE not contributing
ablate-noprf	0.3000	~12	150822	keep	Ablation: no PRF. 9/30
ablate-noboosted	0.2667	~12	135541	keep	Ablation: naive BM25. 8/30 — boosted BM25 biggest contributor
483189f-sick	0.0667	~12	31787	discard	V1-V4 (Ollama was sick). 2/30 — invalid
483189f-retry	0.2333	~12	168595	discard	V1-V4 unprefixed docs. 7/30 — prefix mismatch hurts vector recall
v1234-prefixed	0.3000	~12	141325	keep	V1-V4 with search_document: prefix. 9/30 — vector search adds no value even with proper prefixes
f6d4868-repro	0.3000	~12	152215	keep	Reproducibility run of f6d4868. 9/30 (variance: 9-11 range, mean ~10)
ablate-nohyde	0.3667	~12	168311	keep	Ablation: no HyDE (boosted BM25 + PRF only). 11/30 — HyDE not contributing
ablate-noprf	0.3000	~12	150822	keep	Ablation: no PRF (boosted BM25 + HyDE only). 9/30 — PRF provides ~1-2 query lift
ablate-noboosted	0.2667	~12	135541	keep	Ablation: naive BM25 (HyDE + PRF only). 8/30 — boosted BM25 is the biggest contributor
mar19-baseline	0.1000	~12	43381	keep	mar19 baseline (unchanged code, native BM25, k=10, 12 turns). 3/30 (qwen2.5:7b)
488fa6a	0.1333	~12	68494	keep	Remove vector_search, fix example to use question var + batch_llm_query. 4/30 (qwen2.5:7b)
1e40c6c	0.1333	~12	62768	keep	Fix FINAL() extraction — skip code blocks, require quoted strings. 4/30 (qwen2.5:7b)
1e40c6c-9b	0.2667	~12	124705	keep	Same code, qwen3.5:9b. 8/30: 175+191+464+469+643+797+893+1034
0b7da23-9b	0.1333	~12	139257	discard	Fuzzy term matching (edit distance 1, boost 0.5). 4/30 — fuzzy noise hurts retrieval
adae6c3	0.1667	~12	98788	keep	Hybrid BM25+ColBERT (RRF fusion), first-stage ColBERT via LanceDB multi-vector MaxSim
a6d682c	0.3667	~12	119399	keep	Hybrid BM25-first + ColBERT augment (ColBERT-unique docs appended). Ties BM25 best
a6d682c-colbert	0.2667	~12	115047	keep	ColBERT-only search (Mode A). 8/30 — worse than boosted BM25 (11/30)
2db8944	0.2333	~12	114536	discard	Hybrid BM25+ColBERT augment with [Q]/[D] prefix fix + IVF-HNSW-SQ. 7/30 — regression
46933fe	0.3000	~12	121633	keep	Aggressive FINAL() prompts. 28/30 completed (was 12/30). 9/30 correct. New: 1128+1144+572+689. Lost: 175+853(near-miss)
8414fef	0.2667	~12	120902	keep	Refusal filter v1. 26/30 completed, 1 refusal rejected. New: Q894+Q1106. 8/30
5946fae-sglang	0.1333	~12	113165	discard	SGLang fp8 Qwen3.5-9B. 4/30 — significant regression from Ollama (8-11/30). fp8 quality loss
gepa-v1	0.1667	~12	119474	discard	GEPA-optimized prompt (5 calls, 8-query subset). 5/30 — regression from baseline 8-11/30. Needs more iterations.
gepa-v2	0.2333	~12	137674	keep	GEPA v2 prompt (3x avg, GPT-5). 7/30 exact, 8/30 fuzzy. New: Q1030+Q572+Q885. Union across runs: 13+/30
gepa-v3	0.3333	~12	138141	NEW-BEST-TIE	GEPA v3 prompt (18KB). 10/30 exact, 11/30 fuzzy. New: Q830! Ties all-time best.
hindsight-ab	0.1000	~12	91281	discard	Hindsight Phase A+B (Python client, BM25s). 3/30 exact, 5/30 LLM. Almost all max_turns — FINAL() not called.
hindsight-ab-v2	0.2333	~12	69383	keep	Hindsight Phase A+B re-run. 7/30 exact, 8/30 fuzzy. Q152 new! 69K tokens (efficient)
hindsight-ab-v3	0.2333	~12	70457	keep	Hindsight Phase A+B v3 (tweaked). 7/30 exact. Gained Q625+Q797+Q853+Q885, lost Q152+Q572+Q643+Q1128
hindsight-rust	0.2667	~12	121864	keep	Hindsight Rust (native tantivy). 8/30 exact. Q830+Q1030+Q853 exact.
hindsight-passages	0.3333	~12	109556	NEW-BEST	Passage index + native tantivy. 10/30 exact, 12/30 fuzzy. NEW ALL-TIME BEST (fuzzy). Q1106+Q1144 new!
hindsight-passages-rerank	0.2333	~12	105930	discard	Passage+ColBERT rerank. 7/30 exact, 8/30 fuzzy. Reranking hurts — regression from passage-only (12/30). Q747 new!
passages-rerank-c1	0.4333	~12	98272	NEW-BEST	Passage+ColBERT rerank (8192 tokens). 13/30 exact, 16/30 fuzzy. MASSIVE NEW BEST!
passages-rerank-c2	0.3667	~12	123128	discard	C2: top-50 rerank pool. 11/30 exact, 14/30 fuzzy. Worse than C1 top-200 (16/30 fuzzy). Q1034+Q1115 new but lost 5.
passages-rerank-c3	0.4333	~12	110722	keep	C3: query condensation + 8192 tokens. 13/30 exact, 14/30 fuzzy. Q1029 FIRST EVER CORRECT!
c4-colbert-retriever	0.3000	~12	118247	discard	C4: ColBERT first-stage retriever + passage. 9/30 exact, 11/30 fuzzy. Below C1 reranker (16/30).
c4-rrf	0.3000	~12	119892	keep	C4 with RRF fusion (not augmentation). 9/30 exact, 12/30 fuzzy. +1 over augmentation but still below C1 reranker (16/30).
c4-rrf-fast	0.2667	~12	107909	keep	C4 RRF with nprobes=1+refine=2. 8/30 exact, 10/30 fuzzy. Slight regression from slow C4 (12/30) but much faster.
c7-passage-rerank	0.2333	~12	115809	discard	C7: passage-only → ColBERT rerank. 7/30 exact, 10/30 fuzzy. Worse than C1 (16/30). Passage-only has narrower coverage.
colbert-primary-rerank	0.3000	~12	151489	keep	ColBERT primary retriever + ColBERT reranker. 9/30 exact, 12/30 fuzzy. Q1029 correct! Below C1 (16/30) — extraction bottleneck.
colbert-passage-rerank	0.2333	~12	116178	keep	ColBERT retrieval + passage snippets + reranker. 7/30 exact, 8/30 fuzzy. Q706+Q893 FIRST EVER CORRECT!
passages-4096-rerank	0.3667	~12	95499	keep	4096-byte passages + ColBERT rerank. 11/30 exact, 14/30 fuzzy. Close to C1 (16/30), more efficient (95K tokens).
passages-4096-doc-rrf-rerank	0.3667	~12	108395	discard	4096 passages + doc RRF + ColBERT rerank. 11/30 exact, 12/30 fuzzy. Doc RRF hurts again.
passages-4096-noRRF-rerank	0.2333	~12	118358	discard	4096 passage-only (no doc RRF) + rerank. 7/30 exact. Doc RRF actually helps for 4096 passages.
h2h-512-rerank	0.3667	~12	109818	keep	H2H: 512 passages + doc RRF + rerank. 11/30 exact, 14/30 fuzzy.
h2h-4096-rerank	0.4333	~12	113430	NEW-BEST	H2H: 4096 passages + doc RRF + rerank. 13/30 exact, 15/30 fuzzy. Q706+Q747!
hierarchical-rerank	0.3333	~12	93185	keep	Hierarchical passages (512-4096) + title metadata + doc RRF + rerank. 10/30 exact, 11/30 fuzzy. Q893 correct! Most efficient (93K tokens).
colbert-hier-rerank	0.3000	~12	125851	keep	ColBERT retrieval + hier passage snippets (title) + rerank. 9/30 exact, 12/30 fuzzy. Q706 correct.
colbert-passage-rerank-v2	0.3333	~12	127327	keep	ColBERT retrieval + passage expansion rerank. 10/30 exact, 12/30 fuzzy. Q747 correct. +4 over no expansion.
gw-kb-search-only	0.2000	~12	56388	keep	gw-kb hybrid search (BM25+vector+topic-membership RRF), search-only prompt. 6/30 exact, 6/30 fuzzy. Gold doc recall 21/30 but only 4/30 read. Apostrophe bug (fixed post-run).
gw-kb-+topic	0.1333	~12	60008	discard	gw-kb + kb_topic/kb_topics tools. 4/30 exact, 4/30 fuzzy. Topic browsing wastes turns — answer rate dropped from 12/30 to 11/30.
gw-kb-full	0.0667	~12	67110	discard	gw-kb + kb_topic/kb_topics/kb_explore tools. 2/30 exact, 2/30 fuzzy. Worst variant — agent enters explore loops (q853: 36 kb_topic + 17 kb_explore). Topic summaries contain answers but agent can't extract them.
apr19-r9-qwen3-k50	0.1379	~12	68806	discard	R9 diagnostic: qwen3 backend at --k 50 (vs k=10). 4/29 exact = 4/29 fuzzy (1 query aborted by ouros heap panic). Same as k=10's 4/30 — agent can't RECOGNIZE gold even with 5x more candidates visible. Visibility is not the bottleneck; prompt-retriever mismatch is. GEPA co-optimization (R6) required. Also introduces bench/browsecomp/run_per_query.sh driver that isolates ouros crashes per-query.
apr19-baseline-native	0.2069	~12	69350	keep	Clean baseline on this branch: native tantivy BM25 + default SYSTEM_PROMPT + qwen3.5:9b. 6/29 exact, 7/29 fuzzy. Correct: 159, 191, 464, 689, 747, 797, 853. Anchors subsequent experiments; within variance of historical "1e40c6c-9b" (8/30).
apr19-gepa-v3-native	0.2069	~12	124480	discard	GEPA-v3 prompt (configs/gepa_best_v3.txt) on same native BM25 stack. 6/29 exact, 7/29 fuzzy — ties baseline, burns 2x tokens. Correct: 175, 191, 464, 689, 763, 797, 853. Complementary to baseline (union=9/30, 2 unique each: baseline=159+747, gepa-v3=175+763), suggesting prompt ensembling could help, but no single-prompt win.
apr19-passages-4096	0.3793	~12	119561	keep	Passage+doc BM25 RRF (4096-byte chunks, 892K passages, no rerank). 11/29 exact, 13/29 fuzzy — +5/+6 over native BM25 baseline. Gained: 1036, 1128, 469, 572, 763, 830, 885. Lost only 689. Close to historical passages-rerank-c1 (13/30 exact, 16/30 fuzzy) without needing the ColBERT rerank server. Uses `search_with_passages` fusion path that was already wired in.
apr19-passages-hier	0.3103	~12	108637	discard	Hierarchical passage index (chunks 512+1024+2048+4096, 15M passages). 9/29 exact = 9/29 fuzzy — regression of -2/-4 from 4096-only. Smaller chunks have higher term density and outrank larger chunks; the 512-byte snippets are too narrow for reliable extraction. 4096-only remains the sweet spot.
apr19-passages-4096-rerank	0.2414	~12	105205	discard	Passage+doc RRF (4096, retrieve_k=200) → ColBERT blob rerank (rerank_server_blobs.py on 8001 with data/passage-blobs). 7/29 exact = 7/29 fuzzy — regression of -4/-6 from passage-only (13/29 fuzzy). Lost {1036,1128,747,763,830,853,885}, gained {152}. ColBERT's semantic similarity drops BM25's keyword-matched gold docs — matches prior finding that rerank hurts passage-level retrieval on entity-heavy queries. Historical passages-rerank-c1 hit 13/30 exact on same nominal stack, so some of the gap may be run-to-run variance or blob-store/passage-index mismatch, but not worth debugging when the no-rerank variant is already near the old best.
apr19-passages-k15	0.2069	~12	106170	discard	Passage+doc RRF at --k 15 (vs k=10). 6/29 exact, 7/29 fuzzy — regression to baseline-BM25 level. Lost 7 (1036, 469, 747, 763, 797, 830, 885), gained 1 (625). 9B attention can't handle 15 docs in context; k=10 is the hard ceiling on this stack.
apr19-passages-4096-run2	0.3448	~12	120544	keep	Variance check (same config as apr19-passages-4096). 10/29 exact, 12/29 fuzzy. Run-to-run variance on the winner is ±1 on both metrics. BUT union across the two runs = 18/30 (intersect = 7), so ~11 queries "flip" between correct and incorrect across runs — room for a best-of-N/self-consistency ensemble IF we can avoid prior voting failures where wrong answers agreed more than rare correct ones.
apr19-passages-snippet500	0.2414	~12	123625	discard	Passage+RRF with context_snippet_chars 300→500. 7/29 exact, 9/29 fuzzy — regression of -3/-3 below variance band. Longer snippets (500×10=5000 chars vs 3000) overwhelm 9B attention in the same way k=15 did. The context budget at ~3000 chars is the real ceiling, not the per-snippet granularity.
apr19-passages-k8	0.2414	~12	125538	discard	Passage+RRF at --k 8 (vs k=10). 7/29 exact, 10/29 fuzzy — regression of -3/-3 vs k=10 winner. Narrower candidate pool doesn't improve precision; it just drops relevant docs from context. k=8 + k=10 + k=15 together confirm: k=10 is the sweet spot on this stack; both directions hurt.
apr19-s5-lite	0.3103	~12	111238	keep	S5-lite: coverage pre-search (5 sub-queries × top-2 round-robin, no PRF, no round-2). 9/29 exact, 12/29 fuzzy — in-band with winner but COMPLEMENTARY. Wins 2 queries no passage run ever got (q1106, q625), loses 4 reliable ones (q1128, q159, q464, q797 — round-2 refinement was carrying those). 3-way union = 20/30 (passage-run1 + passage-run2 + s5-lite), up from 18/30 for passage-only ensemble. Also 7% cheaper (skips 3 LLM calls). Complementary channel, not a drop-in winner — candidate for ensemble. Added bench config flags presearch_coverage + presearch_coverage_per_query.
apr19-s5-refine	0.2069	~12	126400	discard	S5 + full refine hybrid (coverage round-1 → PRF → round-2). 6/29 exact, 7/29 fuzzy — catastrophic regression. Lost 8 of S5-lite's 12 wins AND 6 of passage's 13 wins. Coverage's 10-doc seed pool is incompatible with PRF (too few docs for meaningful term extraction) and round-2's 3 new queries drown the coverage signal. Not committed.
apr19-s5-filter	0.2759	~12	92686	keep	Coverage round-1 + round-2 FILTER-only (round2_new_queries=0, no PRF). 8/29 exact, 10/29 fuzzy. ANOTHER complementary channel: uniquely wins q152 (no other config gets it), recovers 4 of the 4 "reliable wins" S5-lite lost (1128 only miss), but loses 7 of S5-lite's coverage unlocks. 4-way union (pass-run1 + pass-run2 + s5-lite + s5-filter) = 20/30 fuzzy. Most token-efficient (92K) of any coverage-aware variant. Added presearch_coverage_skip_refine flag.
apr26-sup-presearch-q7	0.2069	~12	79409	discard	Supervisor K=3 batch / dimension: pre-search BREADTH. n_presearch_queries=7 (vs 5). Required two fixes: wired the .take(N) plus interpolated N into the LLM extract prompt. Result: 6/29 exact, 8/29 fuzzy. -3/-5 vs baseline. 7 sub-queries → ~35 round-1 candidates → round-2 refinement (limit 25) drops some, agent sees noisier mix. Pre-search breadth is saturated at 5 on the passage+RRF stack.
apr26-sup-coverage-per3	0.2069	~12	67665	discard	Supervisor K=3 batch / dimension: coverage DEPTH. presearch_coverage=true, per_query=3 (vs 2 in S5-lite). 15 round-robin docs vs 10. Result: 6/29 exact, 7/29 fuzzy — -3/-5 vs S5-lite (9/12). Same 9B-attention-overflow pattern as the earlier k=15 regression. Token usage 67K (vs S5-lite 111K) — agent terminates early on weak evidence.
apr26-sup-prf-strong	0.2069	~12	88588	discard	Supervisor K=3 batch / dimension: query EXPANSION aggressiveness. prf_top_n 5→8, prf_term_count 5→8, prf_k 3→5, round2_new_queries 3→5. Result: 6/29 exact, 6/29 fuzzy — biggest regression of the batch (-5/-7). Aggressive PRF + round-2 expansion adds noise that drowns the signal. Confirms "less aggressive PRF is better" — passage retrieval already gives enough candidates.
apr27-sup-coverage-per1	0.1724	~12	50833	discard	Supervisor K=3 batch 2 / coverage NARROWNESS. presearch_coverage=true, per_query=1 (5-doc round-robin). 5/29 exact, 7/29 fuzzy. Too narrow — agent terminates early (51K tokens, lowest of any). Combined with S5-lite (per=2: 9/12) and coverage-per3 (per=3: 6/7), confirms per_query=2 is the sweet spot for coverage depth.
apr27-sup-prf-light	0.1034	~12	64686	discard	Supervisor K=3 batch 2 / expansion MINIMALISM. prf_term_count 5→3, prf_k 3→2, round2_new_queries 3→0. 3/29 exact, 3/29 fuzzy — biggest regression of any experiment. Too little expansion starves the candidate pool. Combined with prf-strong (8/5: 6/6 fuzzy) and default (5/3: 13 fuzzy), confirms default is the sweet spot for expansion.
apr27-sup-narrow-q3	0.1379	~12	71747	discard	Supervisor K=3 batch 2 / breadth NARROWNESS. n_presearch_queries=3 (with prompt-template fix). 4/29 exact, 7/29 fuzzy. Too few sub-queries undercoverage the question. Combined with default (q=5: 13 fuzzy) and presearch-q7 (q=7: 8 fuzzy), confirms q=5 is the sweet spot for pre-search breadth.
apr27-m1-monot5	0.2759	~12	145473	keep	M1: BM25+passage RRF → castorini/monot5-3b-msmarco-10k cross-encoder rerank (depth=200, top-10 to agent). 8/29 exact, 10/29 fuzzy. Slight regression vs no-rerank baseline (11/29, 13/29) but COMPLEMENTARY: lost 6 keyword-matched gold docs (1036, 159, 747, 763, 797, 853), gained 3 unique queries (1144, 625, 643). Union with baseline = 16/30 fuzzy — a 5th complementary channel for ensemble. Same pattern as ColBERT blob rerank: neural rerankers favor topically-similar over keyword-matched on this 9B+keyword-query stack. Meng's reported +20.5% from monoT5 likely depends on (a) Q2Q reformulation (M2 — blocked on this) and (b) larger agent (gpt-oss-20b vs qwen3.5:9b). Server: bench/browsecomp/rerank_server_monot5.py on port 8002.
apr28-m2-q2q	0.2069	~12	100513	keep	M2: same stack as M1 + Q2Q reformulation (rerank_q2q=true config flag). Before each rerank request, qwen3.5:9b reformulates the agent's keyword query into an NL question; raw query still used for BM25 retrieval, only the reranker sees the NL version. 6/29 exact, 8/29 fuzzy — REGRESSION from M1 (8/10), opposite of Meng's predicted +5-10%. Recovered 3 keyword-matched queries M1 dropped (q159, q797, q853) but lost 5 of M1's semantic wins (q1128, q469, q625, q643, q885). Likely causes: qwen3.5:9b is a worse Q2Q reformulator than Meng's gpt-oss-20b; sample30 variance dominates ±2 effects. Q2Q is implemented as a complementary channel rather than a strict improvement; a 6th channel for the ensemble bucket. CRITICAL SESSION FINDING: 6-way oracle union (pass-r1 + pass-r2 + S5-lite + S5-filter + M1 + M2) = 20/30 fuzzy — SAME as the 4-way oracle ceiling. M1 and M2 added zero new gold queries; only 10/30 queries are never solved by any channel.
