commit	accuracy	avg_searches	avg_tokens	status	description
apr28-p7-passages-1500	0.1724	~12	85606	discard	P7: Meng-style passage recipe — chunks rebuilt at 1500 bytes (~250 words) instead of 4096. Title-prepending and sentence-boundary alignment were already in the Rust builder; only the chunk size differed. 5/29 exact, 7/29 fuzzy — regression vs 4096-only (11/29, 13/29). Token usage 86K (low, agent terminating early). 7-way union (added P7) is STILL 20/30 fuzzy, identical to the 6-way; P7 added zero new gold queries. Confirms: smaller chunks just don't contain enough context for qwen3.5:9b's snippet-based extraction even when not competing with bigger chunks. The 20/30 ceiling on this branch is locked across all explored single-config variants.
apr28-h-c2-mimic	0.1379	~12	47824	keep	H-C2: monoT5 with rerank_candidate_pool=50 (vs M1's 200). Recreate historical c2 recipe. 4/29 exact = 4/29 fuzzy — biggest single-config regression of the session. BUT unlocks q175 (Cocomelon), one of the 10 never-before-solved queries on this branch — 9-way oracle union now 21/30 (+1 above prior 20/30 ceiling). Tighter rerank pool either (a) reduces topic-zone confusion for some queries or (b) happens to put gold in the top-50 RRF instead of the bottom of top-200. Lowest accuracy + highest complementarity = textbook ensemble candidate. Added rerank_candidate_pool config flag.
apr28-h-pass-expand	0.2069	~12	45364	discard	H-PE: monoT5 with rerank_passage_expansion=true and pool=20. Each docid in the 20-doc candidate pool is expanded into ALL its passages, monoT5 picks best per doc (request 5×k, dedupe by docid). Recreates the historical passage-expansion rerank recipe (colbert-passage-rerank-v2 used ColBERT). 6/29 exact = 6/29 fuzzy. Added zero new queries to the cross-channel union — purely rearranged within the existing frontier. Confirms: passage-level rerank granularity isn't a frontier-expander on this stack with monoT5; the historical 12/30 from colbert-passage-rerank-v2 was likely ColBERT-specific. Added rerank_passage_expansion config flag.
